{
  "id": "jabir-ibn-hayyan",
  "wikidata": "Q167852",
  "name": "Jabir ibn Hayyan",
  "category": "scientist",
  "start": 721,
  "end": 815,
  "date_precision": "year",
  "location": {
    "lat": 36.49,
    "lon": 59.52,
    "place": "Tus"
  },
  "summary": "8th-century Islamic alchemist and author, born in Tus. Imported from Wikidata; a summary in our own words is still to be written.",
  "links": {
    "wikipedia": "https://en.wikipedia.org/wiki/Jabir_ibn_Hayyan"
  },
  "sources": [
    "https://www.wikidata.org/wiki/Q167852",
    "https://en.wikipedia.org/wiki/Jabir_ibn_Hayyan"
  ],
  "disputed": false
}
