{
  "id": "joseph-addison",
  "wikidata": "Q206384",
  "name": "Joseph Addison",
  "category": "philosopher",
  "start": 1672,
  "end": 1719,
  "date_precision": "day",
  "location": {
    "lat": 51.21,
    "lon": -1.77,
    "place": "Milston"
  },
  "summary": "English essayist, poet, playwright and politician (1672–1719), born in Milston. Imported from Wikidata; a summary in our own words is still to be written.",
  "links": {
    "wikipedia": "https://en.wikipedia.org/wiki/Joseph_Addison"
  },
  "sources": [
    "https://www.wikidata.org/wiki/Q206384",
    "https://en.wikipedia.org/wiki/Joseph_Addison"
  ],
  "disputed": false
}
