{
  "id": "mikhail-bakunin",
  "wikidata": "Q27645",
  "name": "Mikhail Bakunin",
  "category": "philosopher",
  "start": 1814,
  "end": 1876,
  "date_precision": "day",
  "location": {
    "lat": 56.94,
    "lon": 34.45,
    "place": "Priamukhino"
  },
  "summary": "Russian revolutionary anarchist and philosopher (1814–1876), born in Priamukhino. Imported from Wikidata; a summary in our own words is still to be written.",
  "links": {
    "wikipedia": "https://en.wikipedia.org/wiki/Mikhail_Bakunin"
  },
  "sources": [
    "https://www.wikidata.org/wiki/Q27645",
    "https://en.wikipedia.org/wiki/Mikhail_Bakunin"
  ],
  "disputed": false
}
